{
  "schemaVersion": "waar-acceptance-zones/0.2",
  "experimentId": "t26-monotype-equal-cost",
  "corpusFingerprint": "fe04b09795eed9760e4c75f0b4ecb8840a0857554a6ed090049c041e9f98c48f",
  "comparisonProfileId": "monotype-equal-cost-v1",
  "valuationId": "t24-common-valuation-v1",
  "generation": {
    "id": "candidate-centered-monotype-drafts-v1",
    "label": "Objectifs monotypes centrés sur le point de départ — à définir",
    "radiusX": 0.05,
    "radiusY": 0.1,
    "readOnly": false
  },
  "zones": [
    {
      "id": "soldier-vs-soldier-attacker-tip-survivors",
      "scenarioId": "soldier-vs-soldier",
      "side": "attacker",
      "endpoint": "tip",
      "xMetric": "winRate",
      "yMetric": "survivors",
      "shape": "ellipse",
      "center": {
        "x": 0.5502409638554219,
        "y": 0.5047640022060453
      },
      "radii": {
        "x": 0.05,
        "y": 0.1
      },
      "enabled": true,
      "approval": "confirmed",
      "source": {
        "kind": "observation",
        "referenceId": "roles-a@t23.0",
        "referencePointId": "soldier-vs-soldier/attacker/tip",
        "originalCenter": {
          "x": 0.49,
          "y": 0.22775024975024974
        },
        "modifiedManually": true
      }
    },
    {
      "id": "soldier-vs-soldier-attacker-tip-structure",
      "scenarioId": "soldier-vs-soldier",
      "side": "attacker",
      "endpoint": "tip",
      "xMetric": "winRate",
      "yMetric": "structure",
      "shape": "ellipse",
      "center": {
        "x": 0.5502409638554219,
        "y": 0.22765539494794096
      },
      "radii": {
        "x": 0.05,
        "y": 0.1
      },
      "enabled": true,
      "approval": "confirmed",
      "source": {
        "kind": "observation",
        "referenceId": "roles-a@t23.0",
        "referencePointId": "soldier-vs-soldier/attacker/tip",
        "originalCenter": {
          "x": 0.49,
          "y": 0.22765539494794096
        },
        "modifiedManually": true
      }
    },
    {
      "id": "soldier-vs-soldier-attacker-tip-economicValue",
      "scenarioId": "soldier-vs-soldier",
      "side": "attacker",
      "endpoint": "tip",
      "xMetric": "winRate",
      "yMetric": "economicValue",
      "shape": "ellipse",
      "center": {
        "x": 0.5502409638554219,
        "y": 0.22775024975024974
      },
      "radii": {
        "x": 0.05,
        "y": 0.1
      },
      "enabled": true,
      "approval": "confirmed",
      "source": {
        "kind": "observation",
        "referenceId": "roles-a@t23.0",
        "referencePointId": "soldier-vs-soldier/attacker/tip",
        "originalCenter": {
          "x": 0.49,
          "y": 0.22775024975024974
        },
        "modifiedManually": true
      }
    },
    {
      "id": "soldier-vs-soldier-defender-tip-survivors",
      "scenarioId": "soldier-vs-soldier",
      "side": "defender",
      "endpoint": "tip",
      "xMetric": "winRate",
      "yMetric": "survivors",
      "shape": "ellipse",
      "center": {
        "x": 0.44975903614457813,
        "y": 0.504262503704547
      },
      "radii": {
        "x": 0.05,
        "y": 0.1
      },
      "enabled": true,
      "approval": "confirmed",
      "source": {
        "kind": "observation",
        "referenceId": "roles-a@t23.0",
        "referencePointId": "soldier-vs-soldier/defender/tip",
        "originalCenter": {
          "x": 0.51,
          "y": 0.22724875124875124
        },
        "modifiedManually": true
      }
    },
    {
      "id": "soldier-vs-soldier-defender-tip-structure",
      "scenarioId": "soldier-vs-soldier",
      "side": "defender",
      "endpoint": "tip",
      "xMetric": "winRate",
      "yMetric": "structure",
      "shape": "ellipse",
      "center": {
        "x": 0.44975903614457813,
        "y": 0.22714476462898212
      },
      "radii": {
        "x": 0.05,
        "y": 0.1
      },
      "enabled": true,
      "approval": "confirmed",
      "source": {
        "kind": "observation",
        "referenceId": "roles-a@t23.0",
        "referencePointId": "soldier-vs-soldier/defender/tip",
        "originalCenter": {
          "x": 0.51,
          "y": 0.22714476462898212
        },
        "modifiedManually": true
      }
    },
    {
      "id": "soldier-vs-soldier-defender-tip-economicValue",
      "scenarioId": "soldier-vs-soldier",
      "side": "defender",
      "endpoint": "tip",
      "xMetric": "winRate",
      "yMetric": "economicValue",
      "shape": "ellipse",
      "center": {
        "x": 0.44975903614457813,
        "y": 0.22724875124875124
      },
      "radii": {
        "x": 0.05,
        "y": 0.1
      },
      "enabled": true,
      "approval": "confirmed",
      "source": {
        "kind": "observation",
        "referenceId": "roles-a@t23.0",
        "referencePointId": "soldier-vs-soldier/defender/tip",
        "originalCenter": {
          "x": 0.51,
          "y": 0.22724875124875124
        },
        "modifiedManually": true
      }
    },
    {
      "id": "soldier-vs-spearman-attacker-tip-survivors",
      "scenarioId": "soldier-vs-spearman",
      "side": "attacker",
      "endpoint": "tip",
      "xMetric": "winRate",
      "yMetric": "survivors",
      "shape": "ellipse",
      "center": {
        "x": 0.117647058823529,
        "y": 0.24393800698319368
      },
      "radii": {
        "x": 0.05,
        "y": 0.1
      },
      "enabled": true,
      "approval": "confirmed",
      "source": {
        "kind": "observation",
        "referenceId": "roles-a@t23.0",
        "referencePointId": "soldier-vs-spearman/attacker/tip",
        "originalCenter": {
          "x": 0,
          "y": 0.002287712287712288
        },
        "modifiedManually": true
      }
    },
    {
      "id": "soldier-vs-spearman-attacker-tip-structure",
      "scenarioId": "soldier-vs-spearman",
      "side": "attacker",
      "endpoint": "tip",
      "xMetric": "winRate",
      "yMetric": "structure",
      "shape": "ellipse",
      "center": {
        "x": 0.117647058823529,
        "y": 0.002276682885891886
      },
      "radii": {
        "x": 0.05,
        "y": 0.1
      },
      "enabled": true,
      "approval": "confirmed",
      "source": {
        "kind": "observation",
        "referenceId": "roles-a@t23.0",
        "referencePointId": "soldier-vs-spearman/attacker/tip",
        "originalCenter": {
          "x": 0,
          "y": 0.002276682885891886
        },
        "modifiedManually": true
      }
    },
    {
      "id": "soldier-vs-spearman-attacker-tip-economicValue",
      "scenarioId": "soldier-vs-spearman",
      "side": "attacker",
      "endpoint": "tip",
      "xMetric": "winRate",
      "yMetric": "economicValue",
      "shape": "ellipse",
      "center": {
        "x": 0.117647058823529,
        "y": 0.002287712287712288
      },
      "radii": {
        "x": 0.05,
        "y": 0.1
      },
      "enabled": true,
      "approval": "confirmed",
      "source": {
        "kind": "observation",
        "referenceId": "roles-a@t23.0",
        "referencePointId": "soldier-vs-spearman/attacker/tip",
        "originalCenter": {
          "x": 0,
          "y": 0.002287712287712288
        },
        "modifiedManually": true
      }
    },
    {
      "id": "soldier-vs-spearman-defender-tip-survivors",
      "scenarioId": "soldier-vs-spearman",
      "side": "defender",
      "endpoint": "tip",
      "xMetric": "winRate",
      "yMetric": "survivors",
      "shape": "ellipse",
      "center": {
        "x": 0.882352941176471,
        "y": 0.7521370280014681
      },
      "radii": {
        "x": 0.05,
        "y": 0.1
      },
      "enabled": true,
      "approval": "confirmed",
      "source": {
        "kind": "observation",
        "referenceId": "roles-a@t23.0",
        "referencePointId": "soldier-vs-spearman/defender/tip",
        "originalCenter": {
          "x": 1,
          "y": 0.47708791208791207
        },
        "modifiedManually": true
      }
    },
    {
      "id": "soldier-vs-spearman-defender-tip-structure",
      "scenarioId": "soldier-vs-spearman",
      "side": "defender",
      "endpoint": "tip",
      "xMetric": "winRate",
      "yMetric": "structure",
      "shape": "ellipse",
      "center": {
        "x": 0.882352941176471,
        "y": 0.4769627187331731
      },
      "radii": {
        "x": 0.05,
        "y": 0.1
      },
      "enabled": true,
      "approval": "confirmed",
      "source": {
        "kind": "observation",
        "referenceId": "roles-a@t23.0",
        "referencePointId": "soldier-vs-spearman/defender/tip",
        "originalCenter": {
          "x": 1,
          "y": 0.4769627187331731
        },
        "modifiedManually": true
      }
    },
    {
      "id": "soldier-vs-spearman-defender-tip-economicValue",
      "scenarioId": "soldier-vs-spearman",
      "side": "defender",
      "endpoint": "tip",
      "xMetric": "winRate",
      "yMetric": "economicValue",
      "shape": "ellipse",
      "center": {
        "x": 0.882352941176471,
        "y": 0.47708791208791207
      },
      "radii": {
        "x": 0.05,
        "y": 0.1
      },
      "enabled": true,
      "approval": "confirmed",
      "source": {
        "kind": "observation",
        "referenceId": "roles-a@t23.0",
        "referencePointId": "soldier-vs-spearman/defender/tip",
        "originalCenter": {
          "x": 1,
          "y": 0.47708791208791207
        },
        "modifiedManually": true
      }
    },
    {
      "id": "soldier-vs-archer-attacker-tip-survivors",
      "scenarioId": "soldier-vs-archer",
      "side": "attacker",
      "endpoint": "tip",
      "xMetric": "winRate",
      "yMetric": "survivors",
      "shape": "ellipse",
      "center": {
        "x": 0.24734231041814314,
        "y": 0.25009438498632997
      },
      "radii": {
        "x": 0.05,
        "y": 0.1
      },
      "enabled": true,
      "approval": "confirmed",
      "source": {
        "kind": "observation",